{
 "changed_files": [
  "src/ciw/lab/research_portfolio.py",
  "scripts/reproduce_lab.py"
 ],
 "evidence_status": {
  "counts": {
   "analytic": 0,
   "hardware_measured": 0,
   "independently_verified": 0,
   "not_established": 0,
   "numerically_verified": 1,
   "provider_backed": 0,
   "synthetic": 0
  },
  "primary": "numerically_verified"
 },
 "expected_invariant": "Aggregates are exact functions of retained reports and never change a label.",
 "experiment": "When the queue runs inside that command, it exports CIW_LAB_CLEAN_ROOM with the wheel digest; this task checks that the imported package is that wheel's files. Outside the command the task is partial.",
 "failure_modes_checked": [
  "missing reports",
  "report identity mismatch (validate_report)",
  "aggregate differs from its re-read bytes"
 ],
 "findings": [
  {
   "assigned_by": "ciw.lab.evidence",
   "basis": {
    "checks": [
     {
      "comparison": "abs_le",
      "observed": 0.0,
      "passed": true,
      "reference": "clean-room conditions failing (wheel digest, package files equal to the wheel's, isolated venv, installed package)",
      "reference_kind": "exact_arithmetic",
      "tolerance": 0.0
     }
    ]
   },
   "claim": "This queue run executed inside the clean-room reproduction",
   "domain": "computational_pipeline",
   "evidence_status": "numerically_verified",
   "uncertainty": null,
   "unit": null,
   "value": true
  }
 ],
 "generated_artifacts": [],
 "hypothesis": "One command builds an isolated wheel, installs it into a fresh virtual environment, runs the lab tests and the whole queue, and matches the retained reports within their regression tolerances.",
 "input_data": [
  "Retained reports T001-T154 in the same output directory"
 ],
 "mathematical_model": "scripts/reproduce_lab.py: wheel -> venv -> pytest (JUnit) -> ciw lab run --all -> ciw lab verify.",
 "number": 164,
 "numerical_result": "Clean-room evidence for the built wheel: {'wheel_bytes_match': True, 'installed_from_wheel': True, 'isolated_interpreter': True, 'package_inside_environment': True}.",
 "observation_model": "No physical observation; reads retained computational records only.",
 "physical_validation_status": {
  "statement": "Physical validation requires acquired hardware evidence; none was acquired for this task.",
  "status": "not_established"
 },
 "provider_runtime_identity": {
  "ciw_version": "0.1.0",
  "implementation": "ciw.lab",
  "python": "3.12.3",
  "wheel_sha256": "b6b15d0cc4b49a49064c6a021c7009fcae91ca0529f65249534b8d87d9e9d3cd"
 },
 "recommended_next_task": "Run scripts/check_lab.py under Python 3.12 on Windows and on a second Linux host and retain both gate records.",
 "report_id": "sha256:c23cc65b871f8de27563d2eb423c8741cf3b07525a0d2f64607aa217a4b805c1",
 "schema": "ciw.lab-task-report.v1",
 "section": "research-portfolio",
 "state": "completed",
 "task_id": "T164",
 "tests_passed": [
  "check: This queue run executed inside the clean-room reproduction vs clean-room conditions failing (wheel digest, package files equal to the wheel's, isolated venv, installed package)",
  "pytest: tests/test_lab_research_portfolio.py::test_clean_room_marker_is_recognized",
  "pytest: tests/test_lab_research_portfolio.py::test_clean_room_needs_the_installed_package_to_be_the_named_wheel",
  "pytest: tests/test_lab_research_portfolio.py::test_clean_room_prose_does_not_carry_the_wheel_digest"
 ],
 "tests_skipped": [],
 "title": "Produce a one-command clean-room reproduction.",
 "uncertainty": "Comparison with retained reports is performed by the command after this run.",
 "unresolved_assumptions": []
}
