{
 "changed_files": [
  "src/ciw/lab/research_portfolio.py"
 ],
 "evidence_status": {
  "counts": {
   "analytic": 0,
   "hardware_measured": 0,
   "independently_verified": 0,
   "not_established": 1,
   "numerically_verified": 2,
   "provider_backed": 0,
   "synthetic": 0
  },
  "primary": "numerically_verified"
 },
 "expected_invariant": "State, label and basis-component totals agree with a raw-text recount of the report files; every report whose provider probe succeeded contributes a runtime identity, and every identity recorded is held by the inventory; the digest depends only on reproducible content.",
 "experiment": "Aggregate queue coverage, states, labels, basis components, runtimes and report content of T001-T164 into JSON and Markdown and recount states, labels and basis components from the raw report text.",
 "failure_modes_checked": [
  "runtime identities nested below the top level missed",
  "one runtime listed once per task that recorded it",
  "totals disagreeing with the report text",
  "digest over run-specific bytes (timing artifacts, wheel digests)",
  "an undeclared digest encoding",
  "the report read as covering the whole run"
 ],
 "findings": [
  {
   "assigned_by": "ciw.lab.evidence",
   "basis": {
    "checks": [
     {
      "comparison": "abs_le",
      "observed": 0.0,
      "passed": true,
      "reference": "absolute state-count differences from the raw-text recount",
      "reference_kind": "exact_arithmetic",
      "tolerance": 0.0
     },
     {
      "comparison": "abs_le",
      "observed": 0.0,
      "passed": true,
      "reference": "absolute label-count differences from the raw-text recount",
      "reference_kind": "exact_arithmetic",
      "tolerance": 0.0
     },
     {
      "comparison": "abs_le",
      "observed": 0.0,
      "passed": true,
      "reference": "absolute basis-component count differences from the raw-text recount",
      "reference_kind": "exact_arithmetic",
      "tolerance": 0.0
     }
    ]
   },
   "claim": "Release state and label totals match a raw-text recount of the retained report files",
   "domain": "provenance",
   "evidence_status": "numerically_verified",
   "origin": [
    "reference_checks"
   ],
   "regression_tolerance": {
    "abs": 0,
    "rel": 0
   },
   "uncertainty": {
    "basis": "integer count over retained report files; no rounding, sampling or tolerance",
    "kind": "exact",
    "value": 0
   },
   "unit": "reports",
   "value": 164
  },
  {
   "assigned_by": "ciw.lab.evidence",
   "basis": {
    "checks": [
     {
      "comparison": "abs_le",
      "observed": 0.0,
      "passed": true,
      "reference": "reports with a successful provider probe and no runtime identity",
      "reference_kind": "exact_arithmetic",
      "tolerance": 0.0
     },
     {
      "comparison": "abs_le",
      "observed": 0.0,
      "passed": true,
      "reference": "recorded runtime identities the inventory does not hold",
      "reference_kind": "exact_arithmetic",
      "tolerance": 0.0
     },
     {
      "comparison": "abs_le",
      "observed": 0.0,
      "passed": true,
      "reference": "runtimes listed on more than one inventory row",
      "reference_kind": "exact_arithmetic",
      "tolerance": 0.0
     }
    ]
   },
   "claim": "Every report whose provider probe succeeded contributes a runtime identity to the release inventory",
   "domain": "provenance",
   "evidence_status": "numerically_verified",
   "origin": [
    "reference_checks"
   ],
   "regression_tolerance": {
    "abs": 0,
    "rel": 0
   },
   "uncertainty": {
    "basis": "integer count over retained report files; no rounding, sampling or tolerance",
    "kind": "exact",
    "value": 0
   },
   "unit": "runtimes",
   "value": 12
  },
  {
   "assigned_by": "ciw.lab.evidence",
   "basis": {},
   "claim": "The release digest is signed by a project key",
   "domain": "provenance",
   "evidence_status": "not_established",
   "expected_not_established": true,
   "origin": [],
   "uncertainty": null,
   "unit": null,
   "value": null
  }
 ],
 "generated_artifacts": [
  {
   "bytes": 6858,
   "path": "artifacts/T165/release-report.json",
   "sha256": "3fce7e4f7b5ef5f864d1e7bdff9d5d463f68e07ce6414a0408b5cb1915bac575"
  },
  {
   "bytes": 3906,
   "path": "artifacts/T165/RELEASE.md",
   "sha256": "4bc599b97f94be6aa0e948cb350f0caeec0427f5131e068b8bfdbbd595c7babc"
  }
 ],
 "hypothesis": "A release report of the tasks before T165 (T001-T164) can be generated entirely from machine-readable queue metadata and their retained reports.",
 "input_data": [
  "Retained reports of T001-T164 in the same output directory",
  "Packaged queue definition (src/ciw/lab/queue.json)"
 ],
 "mathematical_model": "Scope T001-T164: T165 reads only earlier reports, so T165-T168 are not in it; queue-state.json and the dashboard cover the whole run. Totals over states, labels and basis components; queue coverage per section; runtime inventory = revision- or tree-bearing entries anywhere in each provider/runtime identity, one row per runtime with each identity it recorded (a revision recorded without its tree is merged with the entry that records that revision's tree); release digest = sha256 over the UTF-8 bytes of ciw.core.identities.canonical_json (sorted keys, no whitespace, ASCII escapes, NaN refused; the encoding of report identities) of the list [[task, state, headline label, [[claim, label], ...]], ...] in queue order.",
 "number": 165,
 "numerical_result": "Release report of T001-T164: 164 of 168 queue tasks reported; states {'blocked': 2, 'completed': 147, 'partial': 15}; labels {'analytic': 11, 'numerically_verified': 824, 'provider_backed': 10, 'independently_verified': 69, 'not_established': 187}; basis components {'derivation': 145, 'independent_check': 69, 'provider': 96, 'reference_checks': 868, 'synthetic_inputs': 366, 'none': 165}; 12 runtimes (cbsr, csg, ftr, gsie, plsr, ppda, rust, scr, scr-exchange, set, sp1, stfe) with 16 identities.",
 "observation_model": "No physical observation; reads retained computational records only.",
 "physical_validation_status": {
  "statement": "Physical validation requires acquired hardware evidence; none was acquired for this task.",
  "status": "not_established"
 },
 "provider_runtime_identity": {
  "ciw_version": "0.1.0",
  "implementation": "ciw.lab",
  "mpmath": "1.3.0",
  "numpy": "2.4.3",
  "potpourri3d": "1.4.0",
  "pygeodesic": "0.1.11",
  "python": "3.12.3",
  "scipy": "1.16.2",
  "sources": {
   "src/ciw/lab/research_portfolio.py": "e495d96130ff4578b64c09537d871ac59cf727595bbec93f4bacfdad5ca7874d"
  },
  "sympy": "1.14.0"
 },
 "recommended_next_task": "Sign the release digest with a project key once key custody is defined (a cross-cutting open item of T166 and T167, owned by no queue task); a whole-run release record, including T165-T168, is computed outside the queue with research_portfolio.release_record over all retained reports.",
 "report_id": "sha256:cdd451d7ed7a928761ff19cb47aff31cc9deb37422158dca77b168a480b775ba",
 "schema": "ciw.lab-task-report.v1",
 "section": "research-portfolio",
 "state": "completed",
 "task_id": "T165",
 "tests_passed": [
  "check: Release state and label totals match a raw-text recount of the retained report files vs absolute state-count differences from the raw-text recount",
  "check: Release state and label totals match a raw-text recount of the retained report files vs absolute label-count differences from the raw-text recount",
  "check: Release state and label totals match a raw-text recount of the retained report files vs absolute basis-component count differences from the raw-text recount",
  "check: Every report whose provider probe succeeded contributes a runtime identity to the release inventory vs reports with a successful provider probe and no runtime identity",
  "check: Every report whose provider probe succeeded contributes a runtime identity to the release inventory vs recorded runtime identities the inventory does not hold",
  "check: Every report whose provider probe succeeded contributes a runtime identity to the release inventory vs runtimes listed on more than one inventory row",
  "pytest: tests/test_lab_research_portfolio.py::test_release_report_inventories_nested_runtimes",
  "pytest: tests/test_lab_research_portfolio.py::test_release_report_lists_each_runtime_once_and_states_its_scope",
  "pytest: tests/test_lab_research_portfolio.py::test_raw_recounts_derive_the_components_of_findings_retained_without_origin"
 ],
 "tests_skipped": [],
 "title": "Generate a release report from machine-readable metadata.",
 "uncertainty": "Exact counts.",
 "unresolved_assumptions": [
  "The release digest is unsigned.",
  "The digest covers task states, headline labels, claims and their labels, not finding values or artifact bytes; values are compared within tolerance by ciw lab verify.",
  "The report covers T001-T164: T165-T168 run after it and are listed as not reported, so its totals differ from queue-state.json and the dashboard of the same run."
 ]
}
