{
 "changed_files": [
  "src/ciw/lab/research_portfolio.py"
 ],
 "evidence_status": {
  "counts": {
   "analytic": 0,
   "hardware_measured": 0,
   "independently_verified": 0,
   "not_established": 1,
   "numerically_verified": 2,
   "provider_backed": 0,
   "synthetic": 0
  },
  "primary": "numerically_verified"
 },
 "expected_invariant": "Every results row restates its source finding's task, claim, value headline, unit, label and report identity, and its value cell states no number that the source finding's value does not hold.",
 "experiment": "Generate the draft from retained reports of sections exchange-provenance, implementation-targets, lyapunov and parse its results table back against the source findings.",
 "failure_modes_checked": [
  "claims or units containing '|' breaking table rows",
  "labels dropped from rows",
  "values cut inside a number",
  "rows out of order or missing"
 ],
 "findings": [
  {
   "assigned_by": "ciw.lab.evidence",
   "basis": {
    "checks": [
     {
      "comparison": "abs_le",
      "observed": 0.0,
      "passed": true,
      "reference": "results rows that do not parse back to their source finding",
      "reference_kind": "exact_arithmetic",
      "tolerance": 0.0
     }
    ]
   },
   "claim": "Draft results table restates every retained finding of its sections with its retained label",
   "domain": "provenance",
   "evidence_status": "numerically_verified",
   "regression_tolerance": {
    "abs": 0,
    "rel": 0
   },
   "uncertainty": {
    "basis": "integer count over retained report files; no rounding, sampling or tolerance",
    "kind": "exact",
    "value": 0
   },
   "unit": "findings",
   "value": 329
  },
  {
   "assigned_by": "ciw.lab.evidence",
   "basis": {
    "checks": [
     {
      "comparison": "abs_le",
      "observed": 0.0,
      "passed": true,
      "reference": "T155 cases where the label function departs from the stated rules",
      "reference_kind": "exact_arithmetic",
      "tolerance": 0.0
     }
    ]
   },
   "claim": "Draft methods state the evidence-label rules that T155 found the label function to follow",
   "domain": "provenance",
   "evidence_status": "numerically_verified",
   "regression_tolerance": {
    "abs": 0,
    "rel": 0
   },
   "uncertainty": {
    "basis": "integer count over retained report files; no rounding, sampling or tolerance",
    "kind": "exact",
    "value": 0
   },
   "unit": "rules",
   "value": 9
  },
  {
   "assigned_by": "ciw.lab.evidence",
   "basis": {},
   "claim": "Draft has passed external peer review",
   "domain": "provenance",
   "evidence_status": "not_established",
   "expected_not_established": true,
   "uncertainty": null,
   "unit": null,
   "value": null
  }
 ],
 "generated_artifacts": [
  {
   "bytes": 138077,
   "path": "artifacts/T162/evidence-provenance-note-draft.md",
   "sha256": "930859faeafac616dbd845e6e512d89cfaf19ca39c7a65b14b10ee60851ac926"
  }
 ],
 "hypothesis": "An evidence provenance note draft can be assembled entirely from retained findings, with every number traceable to a report identity and every limitation drawn from not_established findings.",
 "input_data": [
  "Retained reports of sections exchange-provenance, implementation-targets, lyapunov",
  "docs/lab/SPECIFICATIONS.md (evidence-label rules)",
  "ciw.lab.evidence constants"
 ],
 "mathematical_model": "Draft = generated Markdown: abstract, methods (task hypotheses and models; the evidence-label rules of the specification), results (one row per finding), limitations (not_established findings and unfinished tasks).",
 "number": 162,
 "numerical_result": "Draft cites 329 findings from 51 reports; 0 results rows differ from their source.",
 "observation_model": "No physical observation; reads retained computational records only.",
 "physical_validation_status": {
  "statement": "Physical validation requires acquired hardware evidence; none was acquired for this task.",
  "status": "not_established"
 },
 "provider_runtime_identity": {
  "ciw_version": "0.1.0",
  "implementation": "ciw.lab",
  "mpmath": "1.3.0",
  "numpy": "2.4.3",
  "python": "3.12.3",
  "scipy": "1.16.2",
  "sources": {
   "src/ciw/lab/research_portfolio.py": "0fd0ed475a38bf81fd2145f64cf1335856a471c58d406347c3b66b0f66672702"
  },
  "sympy": "1.14.0"
 },
 "recommended_next_task": "Human authorship pass, related-work section and external review; physical experiments from the manufacturing protocols.",
 "report_id": "sha256:d1b72a6e7a25724307c333109dff8befb69f89178b4cac5a85f8db49900498bf",
 "schema": "ciw.lab-task-report.v1",
 "section": "research-portfolio",
 "state": "partial",
 "task_id": "T162",
 "tests_passed": [
  "check: Draft results table restates every retained finding of its sections with its retained label vs results rows that do not parse back to their source finding",
  "check: Draft methods state the evidence-label rules that T155 found the label function to follow vs T155 cases where the label function departs from the stated rules",
  "pytest: tests/test_lab_research_portfolio.py::test_paper_drafts_trace_to_reports"
 ],
 "tests_skipped": [],
 "title": "Write an evidence/provenance methods note.",
 "uncertainty": "Numbers carry the uncertainty stated in their source findings.",
 "unresolved_assumptions": [
  "Prose beyond the generated structure, related work and peer review are outstanding."
 ]
}
