{
 "changed_files": [
  "src/ciw/lab/energy_gpu.py",
  "src/ciw/lab/energy_gpu_kernels.py",
  "src/ciw/lab/energy_gpu_telemetry.py",
  "src/ciw/lab/energy_gpu_workload.py",
  "docs/lab/ENERGY_GPU.md"
 ],
 "evidence_status": {
  "counts": {
   "analytic": 0,
   "hardware_measured": 0,
   "independently_verified": 0,
   "not_established": 2,
   "numerically_verified": 0,
   "provider_backed": 0,
   "synthetic": 0
  },
  "primary": "not_established"
 },
 "expected_invariant": "Counter monotone across phases; phases non-overlapping; sensor UUID equals workload UUID; the log names the common workload (kernel, problem, prepared inputs, K, replicas, KL target); every batch meets the declared KL target.",
 "experiment": "Blocked: unavailable requirement(s) hardware:nvidia-gpu. Planned: On the RTX 2080 host: (0) `mkdir -p runs/rtx2080-<date>`; (1) `ciw energy probe --gpu-index 0` must return a reading with status ok; (2) start `TZ=UTC nvidia-smi --query-gpu=timestamp,uuid,name,utilization.gpu,utilization.memory,temperature.gpu,power.draw,clocks.sm,clocks.mem,pstate --format=csv,nounits -lms 100 -f runs/rtx2080-<date>/smi.csv` in the background (T118 needs it; T116 and T119 do not); (3) `ciw energy record --problem examples/energy-accuracy/problem.json --output-dir runs/rtx2080-<date>/capture --duration 10 --replicas 4096 --warmup-batches 2 --idle-duration 2 --gpu-index 0`, then stop the sidecar; (4) `ciw energy replay runs/rtx2080-<date>/capture/log.json`; (5) `CIW_LAB_NVIDIA_SMI_UTC_OFFSET=+00:00 ciw lab run T116 T117 T118 T119 T120 T121 T124 T147 --capture energy-log=runs/rtx2080-<date>/capture/log.json --capture nvidia-smi-csv=runs/rtx2080-<date>/smi.csv --output-dir results/rtx2080-<date>` on the same host (the energy-log capture is T116's and T119's input; T117, T121 and T147 run the same PTX kernel on the common workload); (6) `ciw lab hardware retain results/rtx2080-<date> --retained lab --run-id rtx2080-<date> --host \"<RTX 2080 host>\"`.",
 "failure_modes_checked": [
  "hardware:nvidia-gpu probe (nvidia-smi -L): no device here",
  "acquisition gate exercised by regression tests on synthetic logs: synthetic origin, a log of another workload than the common one, absent or differing host NVML identity, raw bytes retained",
  "planned on a captured log (energy_records.analyze): counter reset or wrap, missing endpoint brackets, sensor/workload UUID mismatch, KL target, minimum duration"
 ],
 "findings": [
  {
   "assigned_by": "ciw.lab.evidence",
   "basis": {
    "notes": [
     "no NVIDIA GPU or NVML in this environment"
    ]
   },
   "claim": "GPU-domain gross energy per measured batch",
   "domain": "physical",
   "evidence_status": "not_established",
   "origin": [],
   "uncertainty": null,
   "unit": "J/batch",
   "value": null
  },
  {
   "assigned_by": "ciw.lab.evidence",
   "basis": {
    "notes": [
     "NVML declares no accuracy or resolution for this counter and no external power meter was compared; the counter is used uncalibrated"
    ]
   },
   "claim": "The NVML total-energy counter of the RTX 2080 has a characterized accuracy and resolution",
   "domain": "sensor_performance",
   "evidence_status": "not_established",
   "origin": [],
   "uncertainty": null,
   "unit": null,
   "value": null
  }
 ],
 "generated_artifacts": [],
 "hypothesis": "Gross GPU-device energy per batch of the fixed binary64 Gaussian VI workload is measurable from NVML total-energy counter differences bracketing each batch.",
 "input_data": [
  "examples/energy-accuracy/problem.json",
  "log.json written by `ciw energy record` on the GPU host"
 ],
 "mathematical_model": "E_batch = (E(end of measurement) - E(start)) / n_batches, gross, background-inclusive, no idle subtraction; per-batch increments from the counter read after each batch.",
 "number": 116,
 "numerical_result": "none: no NVIDIA GPU or NVML in this environment",
 "observation_model": "nvmlDeviceGetTotalEnergyConsumption (mJ, whole device) read between host call brackets; batch outputs retained bitwise and scored by KL against the exact posterior.",
 "physical_validation_status": {
  "statement": "Physical validation requires acquired hardware evidence; none was acquired for this task.",
  "status": "not_established"
 },
 "provider_runtime_identity": {
  "ciw_version": "0.1.0",
  "implementation": "ciw.lab",
  "mpmath": "1.3.0",
  "numpy": "2.4.3",
  "potpourri3d": "1.4.0",
  "pygeodesic": "0.1.11",
  "python": "3.12.3",
  "requirement_probes": {
   "hardware:nvidia-gpu": false
  },
  "scipy": "1.16.2",
  "sources": {
   "src/ciw/lab/energy_gpu.py": "f49195ce5a78ced3c8da1562f4412f2fdc65d8cc2749dd4fbe0b25bc0334e773",
   "src/ciw/lab/energy_gpu_kernels.py": "1198886637535f3f8ec26601aa70cdc16d1c175dc4286aa9807edec3910005d2",
   "src/ciw/lab/energy_gpu_telemetry.py": "6935331e622266868a97ee78f8e34d185aa69009a62fedc8ea8273b3a9312bfc",
   "src/ciw/lab/energy_gpu_workload.py": "5cdaf9fe9f25194dae561e060abf471567cfd3bb8df6c1836630a54c5085a9de"
  },
  "sympy": "1.14.0"
 },
 "recommended_next_task": "Measure gross device energy per batch of the common Gaussian VI workload on the RTX 2080 host (protocol in docs/lab/ENERGY_GPU.md), hardware_measured through the NVML identity gate, in the run that also holds the device telemetry, the energy per accepted result and the kernel's CPU/GPU comparisons: `mkdir -p runs/rtx2080-<date>`; `ciw energy probe --gpu-index 0` must return a reading with status ok; start `TZ=UTC nvidia-smi --query-gpu=timestamp,uuid,name,utilization.gpu,utilization.memory,temperature.gpu,power.draw,clocks.sm,clocks.mem,pstate --format=csv,nounits -lms 100 -f runs/rtx2080-<date>/smi.csv` in the background; `ciw energy record --problem examples/energy-accuracy/problem.json --output-dir runs/rtx2080-<date>/capture --duration 10 --replicas 4096 --warmup-batches 2 --idle-duration 2 --gpu-index 0`; stop the sidecar; `ciw energy replay runs/rtx2080-<date>/capture/log.json`; then `CIW_LAB_NVIDIA_SMI_UTC_OFFSET=+00:00 ciw lab run T116 T117 T118 T119 T120 T121 T124 T147 --capture energy-log=runs/rtx2080-<date>/capture/log.json --capture nvidia-smi-csv=runs/rtx2080-<date>/smi.csv --output-dir results/rtx2080-<date>` on the same host and `ciw lab hardware retain results/rtx2080-<date> --retained lab --run-id rtx2080-<date> --host \"<RTX 2080 host>\"`",
 "report_id": "sha256:560a0302a2034f8d7c2e9d1e8a95e8cd9453c4eb07bb7002909832bb2411ae4c",
 "schema": "ciw.lab-task-report.v1",
 "section": "energy-gpu",
 "state": "blocked",
 "task_id": "T116",
 "tests_passed": [
  "pytest: tests/test_lab_energy_gpu.py::test_gpu_tasks_are_blocked_with_the_recording_protocol",
  "pytest: tests/test_lab_energy_gpu.py::test_operator_log_gate_withholds_physical_labels_from_synthetic_logs",
  "pytest: tests/test_lab_energy_gpu.py::test_operator_log_gate_trust_boundary_is_the_host_identity",
  "pytest: tests/test_lab_energy_gpu.py::test_operator_logs_of_another_workload_are_withheld",
  "pytest: tests/test_lab_energy_gpu.py::test_next_steps_name_work_that_delivers",
  "pytest: tests/test_lab_energy_gpu.py::test_every_numerical_finding_declares_uncertainty_and_tolerance"
 ],
 "tests_skipped": [],
 "title": "Measure GPU energy per batch.",
 "uncertainty": "NVML counter resolution, update interval and accuracy are undeclared; energy is device-wide and includes background work; host brackets add call overhead.",
 "unresolved_assumptions": [
  "Blocked here: no NVIDIA GPU or NVML",
  "NVML documents the total-energy counter for Volta-or-newer fully supported devices; GeForce support is not documented, so `ciw energy probe` must confirm it on this RTX 2080",
  "An operator log is an unauthenticated record; the gate binds it to this host's NVML identity but cannot prove the capture genuine"
 ]
}
