{
 "changed_files": [
  "src/ciw/lab/research_portfolio.py"
 ],
 "evidence_status": {
  "counts": {
   "analytic": 0,
   "hardware_measured": 0,
   "independently_verified": 0,
   "not_established": 0,
   "numerically_verified": 1,
   "provider_backed": 0,
   "synthetic": 0
  },
  "primary": "numerically_verified"
 },
 "expected_invariant": "The catalogue holds exactly the retained findings that carry a counterexample, with their retained labels.",
 "experiment": "Collect counterexample findings from the retained reports, recount counterexample keys in the raw report text, and write JSON and Markdown catalogues.",
 "failure_modes_checked": [
  "counterexample findings dropped by the traversal (raw-text recount)",
  "report identity mismatch (validate_report)"
 ],
 "findings": [
  {
   "assigned_by": "ciw.lab.evidence",
   "basis": {
    "checks": [
     {
      "comparison": "abs_le",
      "observed": 0.0,
      "passed": true,
      "reference": "catalogue size minus the raw-text count of counterexample keys",
      "reference_kind": "exact_arithmetic",
      "tolerance": 0.0
     }
    ]
   },
   "claim": "Counterexample catalogue lists every retained counterexample finding",
   "domain": "computational_pipeline",
   "evidence_status": "numerically_verified",
   "origin": [
    "reference_checks"
   ],
   "regression_tolerance": {
    "abs": 0,
    "rel": 0
   },
   "uncertainty": {
    "basis": "integer count over retained report files; no rounding, sampling or tolerance",
    "kind": "exact",
    "value": 0
   },
   "unit": "counterexamples",
   "value": 213
  }
 ],
 "generated_artifacts": [
  {
   "bytes": 135922,
   "path": "artifacts/T157/counterexamples.json",
   "sha256": "daf165f5ec60b45647b1126008d9185de421df9d89a2efca7f5f1f1f3f367594"
  },
  {
   "bytes": 85839,
   "path": "artifacts/T157/COUNTEREXAMPLES.md",
   "sha256": "cf038afba795c1cb616d50ddb594dc2496297ab7c6841353aa06cdb7418b4674"
  }
 ],
 "hypothesis": "Every counterexample recorded by a queue task can be collected with its witness and evidence status.",
 "input_data": [
  "Retained reports of T001-T156 in the same output directory (findings with a counterexample)"
 ],
 "mathematical_model": "Catalogue = all retained findings carrying a counterexample statement, keyed by task and claim.",
 "number": 157,
 "numerical_result": "213 counterexamples from 111 tasks; labels {'analytic': 2, 'independently_verified': 4, 'numerically_verified': 207}.",
 "observation_model": "No physical observation; reads retained computational records only.",
 "physical_validation_status": {
  "statement": "Physical validation requires acquired hardware evidence; none was acquired for this task.",
  "status": "not_established"
 },
 "provider_runtime_identity": {
  "ciw_version": "0.1.0",
  "implementation": "ciw.lab",
  "mpmath": "1.3.0",
  "numpy": "2.4.3",
  "python": "3.12.3",
  "scipy": "1.16.2",
  "sources": {
   "src/ciw/lab/research_portfolio.py": "145b8ee8456e1dd57bf2a05fa20e1ce55bd33356522436d8901eb1adfb60fc7a"
  },
  "sympy": "1.14.0"
 },
 "recommended_next_task": "Counterexamples are compared with a fresh run by ciw lab verify in CI (scripts/check_lab.py); optional: name one pytest witness per counterexample in each section's tests, so a counterexample is also guarded outside the clean-room comparison.",
 "report_id": "sha256:37257dd8630d7f4b94efffdba984a69c8267f1566be718178ad4c89fef6d6791",
 "schema": "ciw.lab-task-report.v1",
 "section": "research-portfolio",
 "state": "completed",
 "task_id": "T157",
 "tests_passed": [
  "check: Counterexample catalogue lists every retained counterexample finding vs catalogue size minus the raw-text count of counterexample keys",
  "pytest: tests/test_lab_research_portfolio.py::test_counterexample_catalogue",
  "pytest: tests/test_lab_research_portfolio.py::test_next_steps_name_open_work_rather_than_work_done_elsewhere"
 ],
 "tests_skipped": [],
 "title": "Maintain a counterexample catalogue.",
 "uncertainty": "Exact count; each counterexample carries its own uncertainty in its source report.",
 "unresolved_assumptions": [
  "Whether each catalogued counterexample is genuine is not re-judged here; each rests on its source finding's checks.",
  "Counterexamples recorded by T158 and later tasks run after this catalogue and are not in it."
 ]
}
